{
  "world_id": "world",
  "checksum": "fnv1a_4ed6f7df",
  "burg_id": 236,
  "name": "Inve",
  "state_id": 0,
  "province_id": "unknown",
  "tags": [
    "none",
    "river-harbor",
    "ritual-augury"
  ],
  "size_hint": "small",
  "economy_roles": [
    "fishing",
    "augury-services",
    "local-market",
    "waystation"
  ],
  "factions_local": [
    "Harbor Guild",
    "Augur Circle",
    "Merchant Brotherhood agents",
    "Coastwatch"
  ],
  "problems": [
    "scarce-ritual-reagents",
    "smuggling",
    "seasonal-storms"
  ],
  "religion_presence": [
    "Sea-Tide Animisms",
    "Ancestor-Remembrance Cults",
    "Merchant Brotherhood Liturgies"
  ],
  "culture_notes": [
    "Coastal Tongues with Riveric loanwords",
    "boat-first customs; rites held at tide",
    "diet: smoked fish, seaweed; stilted architecture"
  ],
  "quest_hook_slots": [
    "smuggling",
    "ritual-theft",
    "disappearances"
  ],
  "constraints": [
    "rituals require scarce imported reagents",
    "no long-range mind-influence allowed",
    "navigation auguries cannot replace charts/crew"
  ],
  "notes": [
    "at river mouth; serves passing coastal traffic",
    "seasonal access limits overland supply"
  ],
  "generated_at": "2025-09-09T05:30:14.371Z"
}