{
  "world_id": "world",
  "checksum": "fnv1a_6182951",
  "burg_id": 108,
  "name": "Stryt",
  "state_id": 0,
  "province_id": "unknown",
  "tags": [
    "none"
  ],
  "size_hint": "small",
  "economy_roles": [
    "fishing",
    "small-boat repair",
    "reagent trade",
    "coastal-smuggling"
  ],
  "factions_local": [
    "harbormaster's crew",
    "Sea-Tide animist shrine",
    "merchant petty-guild",
    "smuggler cell"
  ],
  "problems": [
    "scarce ritual reagents",
    "smuggling and black-market pressure",
    "periodic bandit raids"
  ],
  "religion_presence": [
    "Sea-Tide Animisms",
    "Merchant Brotherhood Liturgies",
    "Ancestor-Remembrance Cults"
  ],
  "culture_notes": [
    "Coastal Tongues with Riveric Dialect influence",
    "sea-salt and smoked-fish cuisine",
    "ritualized port customs and offerings",
    "practical boatbuilding/minor craft skills"
  ],
  "quest_hook_slots": [
    "smuggling",
    "reagent theft",
    "disappearances at sea"
  ],
  "constraints": [
    "no instant resurrection or true life-replacement magics",
    "ritual magic consumes scarce imported reagents",
    "navigational auguries cannot replace seamanship"
  ],
  "notes": [
    "state affiliation unknown",
    "population data unavailable"
  ],
  "generated_at": "2025-09-09T23:08:31.536Z"
}