{
  "world_id": "world",
  "checksum": "fnv1a_89ba6c1b",
  "burg_id": 455,
  "name": "Suirx",
  "state_id": 0,
  "province_id": "unknown",
  "tags": [
    "estuary",
    "ritual-supply",
    "waystation"
  ],
  "size_hint": "outpost",
  "economy_roles": [
    "fishing",
    "ritual reagent trade",
    "waystation services",
    "salvage and wrecking"
  ],
  "factions_local": [
    "Harborward Guild",
    "Rite-keepers Circle",
    "Smuggler Faction",
    "Clan Watch"
  ],
  "problems": [
    "reagent scarcity",
    "smuggling and illicit trade",
    "lawlessness at night",
    "supply delays from inland"
  ],
  "religion_presence": [
    "Sea-Tide Animisms",
    "Ancestor-Remembrance Cults",
    "Merchant Brotherhood Liturgies"
  ],
  "culture_notes": [
    "Coastal Tongues-influenced dialect",
    "daily life structured around ritual procurement",
    "diet heavy on preserved fish, kelp, seaweed preserves"
  ],
  "quest_hook_slots": [
    "smuggling",
    "failed ritual",
    "missing shipment"
  ],
  "constraints": [
    "No instant resurrection or true life-replacement magics",
    "Ritual magic consumes scarce imported reagents or specialized burg-labors",
    "Navigational auguries exist but cannot replace charts and seamanship"
  ],
  "notes": [
    "Located at an estuary mouth; seasonal storms and shifting sandbars",
    "Limited arable land; relies on imports and salvaged goods"
  ],
  "generated_at": "2025-09-09T05:44:43.312Z"
}