{
  "world_id": "world",
  "checksum": "fnv1a_184e901c",
  "burg_id": 318,
  "name": "Blandle",
  "state_id": 0,
  "province_id": "unknown",
  "tags": [
    "river-halt",
    "crossroads"
  ],
  "size_hint": "small",
  "economy_roles": [
    "river-trade",
    "ferrying",
    "local-market",
    "ritual-supplies"
  ],
  "factions_local": [
    "Riverbarge Guild",
    "Smallholders' Council",
    "Temple Stewardship"
  ],
  "problems": [
    "seasonal-flooding",
    "scarce-imports",
    "bandit raids"
  ],
  "religion_presence": [
    "Ancestor-Remembrance Cults",
    "Merchant Brotherhood Liturgies"
  ],
  "culture_notes": [
    "Riveric dialect dominant with Coastal loanwords",
    "ritualized barter at market days",
    "preservation-heavy cuisine (smoked/fermented)"
  ],
  "quest_hook_slots": [
    "reagent theft",
    "missing ferryman",
    "smuggling"
  ],
  "constraints": [
    "rituals consume scarce imported reagents",
    "no instant resurrection or life-replacement magics",
    "long-range mind influence is rare and institutionally banned"
  ],
  "notes": [
    "population unknown; functions as minor trade node on a secondary river",
    "limited craft industry; relies on itinerant merchants for specialized goods"
  ],
  "generated_at": "2025-09-09T05:35:46.484Z"
}