{
  "world_id": "world",
  "checksum": "fnv1a_f4882097",
  "burg_id": 117,
  "name": "Burg_117",
  "state_id": 0,
  "province_id": "unknown",
  "tags": [
    "coastal",
    "harbor",
    "reagent-harvest"
  ],
  "size_hint": "outpost",
  "economy_roles": [
    "coastal fishing",
    "ritual-reagent foraging",
    "small-scale coastal trade"
  ],
  "factions_local": [
    "Captain's Council",
    "Reagent Gatherers' Guild",
    "Shrine Keepers"
  ],
  "problems": [
    "reagent scarcity",
    "smuggling/banditry",
    "storm damage to boats"
  ],
  "religion_presence": [
    "Sea-Tide Animisms",
    "Ancestor-Remembrance Cults"
  ],
  "culture_notes": [
    "speaks Coastal Tongues dialect",
    "annual tide-remembrance rites",
    "diet: seafood, fermented kelps"
  ],
  "quest_hook_slots": [
    "smuggling",
    "reagent theft",
    "ancestral hauntings"
  ],
  "constraints": [
    "ritual magic consumes scarce imported reagents",
    "no instant resurrection or true life-replacement magics",
    "long-range mind influence is rare and institutionally banned"
  ],
  "notes": [
    "state authority unknown; semi-autonomous outpost",
    "near-medieval tech with localized ritual labs"
  ],
  "generated_at": "2025-09-09T04:10:20.589Z"
}