{
  "world_id": "world",
  "checksum": "fnv1a_a0a9791b",
  "burg_id": 148,
  "name": "Burg_148",
  "state_id": 0,
  "province_id": "unknown",
  "tags": [
    "coastal",
    "ritual-supply"
  ],
  "size_hint": "outpost",
  "economy_roles": [
    "small-harbor trade",
    "ritual reagent foraging",
    "boat maintenance",
    "waystation lodging"
  ],
  "factions_local": [
    "Harbor Guild",
    "Tide-Seers",
    "Smuggler crew"
  ],
  "problems": [
    "reagent scarcity",
    "smuggling",
    "coastal erosion"
  ],
  "religion_presence": [
    "Sea-Tide Animisms",
    "Ancestor-Remembrance Cults"
  ],
  "culture_notes": [
    "Coastal Tongues with Island Creole influence",
    "diet: salted fish, seaweed preserves",
    "folk rituals timed to tides and lunar markers",
    "navigation blends charts with augury rites"
  ],
  "quest_hook_slots": [
    "smuggling",
    "missing ritual reagents",
    "strange tides"
  ],
  "constraints": [
    "no instant resurrection or true life-replacement magics",
    "long-range mind influence is rare and institutionally banned",
    "ritual magic consumes scarce imported reagents"
  ],
  "notes": [
    "State affiliation unknown; semi-autonomous practical governance",
    "Small harbor settlement; vulnerable to storms and supply interruptions"
  ],
  "generated_at": "2025-09-09T04:12:12.857Z"
}