{
  "world_id": "world",
  "checksum": "fnv1a_a208c0d1",
  "burg_id": 162,
  "name": "Styr",
  "state_id": -1,
  "province_id": "unknown",
  "tags": [
    "river-crossing",
    "ritual-hub"
  ],
  "size_hint": "small",
  "economy_roles": [
    "ritual-ingredient trade",
    "ferrying & tolls",
    "grain market",
    "boat repair"
  ],
  "factions_local": [
    "River Guild",
    "Shrine Collegium",
    "Ferrymasters' Syndicate"
  ],
  "problems": [
    "reagent scarcity",
    "seasonal flooding",
    "guild rivalry"
  ],
  "religion_presence": [
    "Ancestor-Remembrance Cults",
    "Sea-Tide Animisms",
    "Merchant Brotherhood Liturgies"
  ],
  "culture_notes": [
    "Riveric dialect heavily used",
    "ferries blessed before voyages",
    "diet of smoked freshwater fish and river vegetables",
    "ritual barges used for ancestor rites"
  ],
  "quest_hook_slots": [
    "smuggling",
    "flood-omen",
    "reagent supply run"
  ],
  "constraints": [
    "ritual magic consumes scarce imported reagents",
    "no instant resurrection or true life-replacement magics"
  ],
  "notes": [
    "near-medieval to early industrial tech with localized ritual practices",
    "navigational auguries exist but seamanship still required"
  ],
  "generated_at": "2025-09-09T05:25:40.162Z"
}