{
  "world_id": "world",
  "checksum": "fnv1a_fa191154",
  "burg_id": 216,
  "name": "Zriokots",
  "state_id": -1,
  "province_id": "unknown",
  "tags": [
    "none",
    "harbor",
    "ritual-supply"
  ],
  "size_hint": "outpost",
  "economy_roles": [
    "ritual-supply depot",
    "coastal fishing",
    "waystation trade"
  ],
  "factions_local": [
    "merchant-guildlet",
    "ritual-cabal",
    "kinship-line"
  ],
  "problems": [
    "reagent shortage",
    "banditry on approaches",
    "jurisdiction disputes"
  ],
  "religion_presence": [
    "Sea-Tide Animisms",
    "Ancestor-Remembrance Cults"
  ],
  "culture_notes": [
    "Coastal Tongues influence in speech",
    "strong ancestor-veneration customs",
    "diet heavy on salt-preserved fish"
  ],
  "quest_hook_slots": [
    "smuggling",
    "reagent heist",
    "ancestral omen"
  ],
  "constraints": [
    "no-instant-resurrection",
    "rituals consume imported reagents",
    "limited combustion industry"
  ],
  "notes": [
    "population unknown; transient trade traffic",
    "remote; navigational auguries used but not relied on alone"
  ],
  "generated_at": "2025-09-09T05:29:06.831Z"
}