{
  "world_id": "world",
  "checksum": "fnv1a_bf2100ab",
  "burg_id": 121,
  "name": "Jarquilly",
  "state_id": 0,
  "province_id": "unknown",
  "tags": [
    "river-port",
    "market",
    "ritual-trade"
  ],
  "size_hint": "small",
  "economy_roles": [
    "river trade hub",
    "fish curing / saltworks",
    "boat repair & chandlery",
    "reagent brokerage"
  ],
  "factions_local": [
    "harbormaster's office",
    "boatmen's guild",
    "Merchant Brotherhood branch",
    "temple circle (Sea-Tide)"
  ],
  "problems": [
    "river banditry",
    "scarce ritual reagents",
    "corrupt tolls/extortion"
  ],
  "religion_presence": [
    "Sea-Tide Animisms",
    "Merchant Brotherhood Liturgies",
    "Ancestor-Remembrance Cults"
  ],
  "culture_notes": [
    "Riveric Dialects with Coastal Tongue loanwords",
    "diet: salt-cured fish, river grain stews",
    "public boat-rites and tide offerings common"
  ],
  "quest_hook_slots": [
    "smuggling",
    "missing shipment",
    "ritual reagent theft"
  ],
  "constraints": [
    "ritual magic consumes scarce imported reagents",
    "no long-range mind influence; resurrection magics banned",
    "combustion tech limited (no high-pressure steam megatechs)"
  ],
  "notes": [
    "near-medieval to early-industrial tech baseline",
    "state authority unclear; frontier/remote governance"
  ],
  "generated_at": "2025-09-09T23:09:37.919Z"
}