{
  "world_id": "world",
  "checksum": "fnv1a_3dd7cdf3",
  "burg_id": 418,
  "name": "Burg_418",
  "state_id": 0,
  "province_id": "unknown",
  "tags": [],
  "size_hint": "outpost",
  "economy_roles": [
    "reagent depot",
    "fishing",
    "waystation",
    "smallcraft repairs"
  ],
  "factions_local": [
    "reagent merchants",
    "harbormaster's guild",
    "ritual adepts",
    "clan elders"
  ],
  "problems": [
    "scarcity of reagents",
    "bandit raids on roads",
    "supply disruptions"
  ],
  "religion_presence": [
    "Sea-Tide Animisms",
    "Ancestor-Remembrance Cults",
    "Merchant Brotherhood Liturgies"
  ],
  "culture_notes": [
    "Coastal Tongues influence",
    "tide-based market rhythms",
    "ritual use of fish oils and smoke"
  ],
  "quest_hook_slots": [
    "smuggling",
    "missing shipment",
    "ritual reagent theft"
  ],
  "constraints": [
    "no instant resurrection magics",
    "ritual magic consumes scarce imported reagents",
    "limited combustion industry"
  ],
  "notes": [
    "near-medieval to early-industrial tech baseline",
    "navigational auguries present but not superior to charts"
  ],
  "generated_at": "2025-09-09T04:30:11.041Z"
}