{
  "world_id": "world",
  "checksum": "fnv1a_bbf03bd6",
  "burg_id": 48,
  "name": "Cocking",
  "state_id": 0,
  "province_id": "unknown",
  "tags": [
    "coastal",
    "fishing",
    "harbor"
  ],
  "size_hint": "small",
  "economy_roles": [
    "fishing",
    "boat-repair",
    "salt-curing",
    "tavern/trade"
  ],
  "factions_local": [
    "Harbormaster's Guild",
    "Fisherfolk Cooperative",
    "Smugglers' Ring",
    "Saltworkers' Lodge"
  ],
  "problems": [
    "smuggling",
    "reagent scarcity",
    "seasonal storms",
    "dilapidated quay"
  ],
  "religion_presence": [
    "Sea-Tide Animisms",
    "Ancestor-Remembrance Cults"
  ],
  "culture_notes": [
    "Coastal Tongues dialect dominant",
    "Tide festivals and boat-launch rites",
    "Diet heavy on salted fish and seaweed"
  ],
  "quest_hook_slots": [
    "smuggling",
    "missing-boat",
    "stolen-reagents"
  ],
  "constraints": [
    "ritual magic requires imported reagents",
    "no instant resurrection",
    "limited combustion industry"
  ],
  "notes": [
    "near-medieval tech with localized ritual magic",
    "population small/unknown",
    "strategic estuarine location"
  ],
  "generated_at": "2025-09-09T05:46:13.261Z"
}