{
  "world_id": "world",
  "checksum": "fnv1a_c1e49c93",
  "burg_id": 434,
  "name": "Burg_434",
  "state_id": 0,
  "province_id": "unknown",
  "tags": [
    "coastal",
    "ritual-hub",
    "waystation"
  ],
  "size_hint": "outpost",
  "economy_roles": [
    "fishing",
    "ritual-supply-trade",
    "waystation-provisions",
    "small-scale-smuggling"
  ],
  "factions_local": [
    "harbor-guild",
    "ritual-venders",
    "kinship-clans"
  ],
  "problems": [
    "scarcity-of-imported-reagents",
    "banditry-along-coast",
    "jurisdictional-disputes"
  ],
  "religion_presence": [
    "Sea-Tide Animisms",
    "Ancestor-Remembrance Cults",
    "Merchant Brotherhood Liturgies"
  ],
  "culture_notes": [
    "Coastal Tongues dialects prevalent",
    "sea-salted cuisine, smoked fish",
    "ritual market days tied to tide calendars"
  ],
  "quest_hook_slots": [
    "missing-reagent-shipment",
    "wreck-salvage",
    "smuggling-ring"
  ],
  "constraints": [
    "rituals consume scarce imported reagents",
    "no instant-resurrection or life-replacement magics",
    "limited-combustion industry"
  ],
  "notes": [
    "state unknown; strategic minor waystation",
    "dependent on coastal trade and ritual supply lines"
  ],
  "generated_at": "2025-09-09T04:31:32.348Z"
}