{
  "world_id": "world",
  "checksum": "fnv1a_a785dc08",
  "burg_id": 35,
  "name": "Camblewent",
  "state_id": 0,
  "province_id": "unknown",
  "tags": [
    "none",
    "coastal",
    "harbor"
  ],
  "size_hint": "small",
  "economy_roles": [
    "fishing",
    "salt-curing",
    "shipchandler",
    "waystation"
  ],
  "factions_local": [
    "Harbor Guild",
    "Tidewatcher Animists",
    "Merchant Agents",
    "Militia"
  ],
  "problems": [
    "smuggling",
    "scarce ritual reagents",
    "storm-damaged piers"
  ],
  "religion_presence": [
    "Sea-Tide Animisms",
    "Ancestor-Remembrance Cults"
  ],
  "culture_notes": [
    "Coastal Tongues + Island Creole blend",
    "tide-honoring processions",
    "diet centered on salted fish and kelp",
    "net-weaving and ritual braid crafts"
  ],
  "quest_hook_slots": [
    "smuggling",
    "shipwreck salvage",
    "reagent procurement"
  ],
  "constraints": [
    "ritual magic requires costly imported reagents",
    "no instant resurrection or life-replacement magics"
  ],
  "notes": [
    "near-medieval to early-industrial tech baseline",
    "navigational auguries used but cannot replace seamanship"
  ],
  "generated_at": "2025-09-09T05:37:46.847Z"
}