{
  "world_id": "world",
  "checksum": "fnv1a_c88e4384",
  "burg_id": 147,
  "name": "Tremari",
  "state_id": 0,
  "province_id": "unknown",
  "tags": [
    "river-port",
    "ritual-hub"
  ],
  "size_hint": "small",
  "economy_roles": [
    "boat traffic & ferrying",
    "fish & salt processing",
    "ritual-ingredient trade",
    "small-market trade"
  ],
  "factions_local": [
    "Harbormaster's Guild",
    "Tide-wardens (Sea-Tide animists)",
    "Ingredient brokers",
    "Scriptoria-affiliated scribes"
  ],
  "problems": [
    "scarcity of imported ritual reagents",
    "smuggling through estuary channels",
    "seasonal tidal flooding"
  ],
  "religion_presence": [
    "Sea-Tide Animisms",
    "Merchant Brotherhood Liturgies",
    "Ancestor-Remembrance Cults"
  ],
  "culture_notes": [
    "Coastal Tongues dialect with Riveric loan-words",
    "seafaring customs & tide superstitions",
    "diet heavy on smoked fish and seaweed",
    "ritualized market days tied to moon-tide"
  ],
  "quest_hook_slots": [
    "smuggling",
    "stolen ritual reagents",
    "disappearances at sea"
  ],
  "constraints": [
    "ritual magic consumes scarce imported reagents",
    "no instant resurrection or life-replacement magics",
    "long-range mind-influence is rare and banned"
  ],
  "notes": [
    "clustered wharves at estuary mouth",
    "local tide-augury markers used by pilots"
  ],
  "generated_at": "2025-09-09T05:24:49.508Z"
}