{
  "world_id": "world",
  "checksum": "fnv1a_8e6268df",
  "burg_id": 476,
  "name": "Burg_476",
  "state_id": 0,
  "province_id": "unknown",
  "tags": [
    "coastal",
    "harbor",
    "ritual-hub"
  ],
  "size_hint": "outpost",
  "economy_roles": [
    "fishing",
    "ritual-component trade",
    "waystation services"
  ],
  "factions_local": [
    "harbor guild",
    "ritual-lab proprietors",
    "smuggler network"
  ],
  "problems": [
    "reagent scarcity",
    "seasonal storms",
    "smuggling-related violence"
  ],
  "religion_presence": [
    "Sea-Tide Animisms",
    "Ancestor-Remembrance Cults",
    "Merchant Brotherhood Liturgies"
  ],
  "culture_notes": [
    "Coastal Tongues dialect",
    "tide-festival centered on smoked fish",
    "seamanship superstitions around auguries",
    "strict ritual etiquette for reagent use"
  ],
  "quest_hook_slots": [
    "smuggling",
    "reagent theft",
    "missing sailors"
  ],
  "constraints": [
    "ritual magic consumes scarce imported reagents",
    "no instant resurrection; long-range mind influence rare and banned",
    "navigational auguries cannot replace charts or seamanship"
  ],
  "notes": [
    "population unknown; transient sailors",
    "located on a narrow inlet; strategic stop for coastal traffic",
    "economy tied to seasonal trade and reagent imports"
  ],
  "generated_at": "2025-09-09T04:34:41.313Z"
}