{
  "world_id": "world",
  "checksum": "fnv1a_ff37aea7",
  "burg_id": 395,
  "name": "Burg_395",
  "state_id": -1,
  "province_id": "unknown",
  "tags": [
    "none",
    "coastal",
    "waystation"
  ],
  "size_hint": "outpost",
  "economy_roles": [
    "supply depot",
    "fishing",
    "ritual reagent trade",
    "ship-repairs"
  ],
  "factions_local": [
    "harbor guild",
    "ritual lodge",
    "smuggler coterie"
  ],
  "problems": [
    "reagent scarcity",
    "banditry",
    "isolation"
  ],
  "religion_presence": [
    "Sea-Tide Animisms",
    "Merchant Brotherhood Liturgies",
    "Ancestor-Remembrance Cults"
  ],
  "culture_notes": [
    "Riveric Dialect influence",
    "seafood-heavy cuisine",
    "ritual barter customs",
    "watchkeeping songs"
  ],
  "quest_hook_slots": [
    "smuggling",
    "missing reagents",
    "shipwreck salvage"
  ],
  "constraints": [
    "ritual magic consumes scarce imported reagents",
    "no instant resurrection or life-replacement magics",
    "long-range mind influence banned"
  ],
  "notes": [
    "Sparse official records; ideal as a mysterious waystation",
    "Rituals rely on imported components and trained handlers"
  ],
  "generated_at": "2025-09-09T04:28:42.467Z"
}