{
  "world_id": "world",
  "checksum": "fnv1a_d658d57a",
  "burg_id": 83,
  "name": "Totham",
  "state_id": 0,
  "province_id": "unknown",
  "tags": [
    "river-port",
    "ritual-harbor"
  ],
  "size_hint": "small",
  "economy_roles": [
    "river trade",
    "fisheries",
    "reagent brokerage",
    "boat maintenance"
  ],
  "factions_local": [
    "Boatmen Guild",
    "Dockmaster's Council",
    "Reagent Wardens",
    "Ancestor Shrine Keepers"
  ],
  "problems": [
    "reagent scarcity",
    "river banditry",
    "corrupt dock fees"
  ],
  "religion_presence": [
    "Sea-Tide Animisms",
    "Ancestor-Remembrance Cults",
    "Merchant Brotherhood Liturgies"
  ],
  "culture_notes": [
    "Riveric Dialects dominant",
    "tide-wakes and ancestor offerings",
    "smoked fish with sea-salt spice"
  ],
  "quest_hook_slots": [
    "smuggling",
    "missing cargo",
    "ritual reagent theft"
  ],
  "constraints": [
    "limited arable hinterland",
    "rituals consume scarce imported reagents",
    "no high-pressure industrialization"
  ],
  "notes": [
    "small, strategic river-mouth outpost",
    "population sparse and seasonally variable with trade"
  ],
  "generated_at": "2025-09-09T05:48:56.369Z"
}